{
"schema":"catalyst.evo-c-transformation-application.v1",
"schema_version":1,
"application_fingerprint":"fnv1a64-v1:038db04907776b14",
"baseline_fingerprint":"fnv1a64-v1:1020304050607080",
"analysis_fingerprint":"fnv1a64-v1:8877665544332211",
"recipe_fingerprint":"fnv1a64-v1:c8c247d67468291a",
"catalogue":{"identity":"catalyst.evo.c.ast-transformations","version":1},
"record_identity":"record-assignment",
"transformation":{"identity":"catalyst.evo.c.assignment-to-compound","version":1},
"parameters":[{"identity":"operator","kind":"choice","integer_value":null,"boolean_value":null,"choice_value":"add"}],
"provider":{"identity":"fixture-clang-ast-provider","version":1,"clang":"clang-18.1.3-fixture"},
"target":{"location_identity":"location-assignment","file":"fixture.c","line":10,"column":5,"end_line":10,"end_column":26,"kind":"spelling","spelling_identity":null,"byte_range":{"start":181,"end":202}},
"ast":{"form":"assignment-binary","operator":"add","condition_context":"none","ranges":{"primary":{"start":181,"end":186},"duplicate_primary":{"start":189,"end":194},"operand":{"start":197,"end":202},"literal":null},"primary_declaration_identity":"declaration-total","duplicate_declaration_identity":"declaration-total","literal_value":0,"result_width_bits":0,"facts":{"primary_plain_identifier":true,"volatile_access":false,"result_unsigned_integer":false,"result_type_matches_primary":true,"scalar_operand":false,"contains_macro":false,"contains_comment":false,"contains_preprocessor":false,"language_extension":false,"ambiguous_target":false,"alias_assumption_required":false}},
"disposition":"edit",
"edit":{"before":{"start":181,"end":202,"size":21,"fingerprint":"fnv1a64-v1:c90cd86fec9f824e","text":"total = total + ready"},"after":{"start":181,"end":195,"replacement_size":14,"replacement_fingerprint":"fnv1a64-v1:9d7ee8e6ece77108","replacement_text":"total += ready"}},
"formatting_policy":"canonical-c17-spaces-v1",
"idempotence_policy":"already-satisfied-no-change-v1",
"semantic_assumptions":["assignment-and-rhs-reference-the-same-declaration","compound-assignment-preserves-the-provider-resolved-c-type","lvalue-is-a-plain-nonvolatile-identifier","target-is-a-spelling-range-without-comments-or-directives"],
"validation_obligations":["baseline-build","baseline-correctness","c17-syntax","sanitizers"],
"human_readable_abstraction":{"reference_form":"exact-source-edit-and-direct-dispatch","projection":"complete-application-json-and-derived-markdown","complete":true,"probabilistic_authority":false},
"snapshot_modified":false,
"candidate_materialized":false
}
